{
    "coord": {
      "lon": -1.3989,
      "lat": 51.0267
    },
    "weather": [
      {
        "id": 803,
        "main": "Clouds",
        "description": "broken clouds",
        "icon": "04n"
      }
    ],
    "base": "stations",
    "main": {
      "temp": 7.87,
      "feels_like": 6.66,
      "temp_min": 7.26,
      "temp_max": 8.06,
      "pressure": 1016,
      "humidity": 89,
      "sea_level": 1016,
      "grnd_level": 1009
    },
    "visibility": 10000,
    "wind": {
      "speed": 2.06,
      "deg": 90
    },
    "clouds": {
      "all": 75
    },
    "dt": 1728861761,
    "sys": {
      "type": 2,
      "id": 2005068,
      "country": "GB",
      "sunrise": 1728887251,
      "sunset": 1728926111
    },
    "timezone": 3600,
    "id": 2652491,
    "name": "Compton",
    "cod": 200
}